Target language lemma,ID,User language gloss,English gloss,POS,Level,Word source,Ex. ID,Form,Analysis,Target language example sentence,User language translation,English translation,Reference,Topic(s),Lesson,
насекомое,8003,insect,,N.Neut.Anim,B2,"Golosa, LM",1,насекомых,Gen.Plur,Укусы насекомых могут вызывать аллергию.,Insect bites can cause an allergic reaction.,,_,животные/растения,,
насекомое,8004,insect,,N.Neut.Anim,B2,"Golosa, LM",2,насекомые,Nom.Plur,Насекомые быстро адаптируются к новым условим.,Insects can easily adapt to new conditions.,,_,животные/растения,,
насекомое,8005,insect,,N.Neut.Anim,B2,"Golosa, LM",3,насекомое,Nom.Sing,Пчела - самое трудолюбивое насекомое.,The bee is the most hardworking insect.,,_,животные/растения,,
насилие,8006,violence,,N.Neut.Inan,B2,LM,1,насилие,Nom.Sing,"В полицейском протоколе говорится, что к жертве применялось физическое насилие. ",The police protocol states that physical abuse has been inflicted upon the victim.,,_,здоровье,,
насилие,8007,violence,,N.Neut.Inan,B2,LM,2,насилия,Gen.Sing,Депутат пытается запретить сцены насилия на телевидении. ,The government official is trying to ban violent scenes on television.,,_,здоровье,,
насилие,8008,violence,,N.Neut.Inan,B2,LM,3,насилием,Ins.Sing,Первый раз в жизни Таня столкнулась с насилием. ,For the first time in her life Tanya experienced violence.,,_,здоровье,,
наследство,8009,inheritance,,N.Neut.Inan,B2,LM,1,наследство,Acc.Sing,Свой дом они получили в наследство от бабушки.,They inherited their house from their grandmother.,,_,люди,,
наследство,8010,inheritance,,N.Neut.Inan,B2,LM,2,наследству,Dat.Sing,Раньше ремесло часто передавали по наследству от отца к сыну.,In earlier times the craft was often passed on from father to son.,,_,люди,,
наследство,8011,inheritance,,N.Neut.Inan,B2,LM,3,наследством,Ins.Sing,"Этот крест был единственным наследством, доставшимся мне от отца.",This cross was the only thing I inherited from my father.,,_,люди,,
нарезать,8012,"chop, slice",,V,B2,LM,1,нарезать,Imperf.Inf,"Взять пять крупных яблок, очистить их, нарезать тонкими ломтиками. ","Take five big apples, peel them and cut them up in thin slices. ",,_,еда,,
нарезать,8013,"chop, slice",,V,B2,LM,2,нарезал,Imperf.Masc.Sing.Past,Я нарезал хлеб и колбасу для бутербродов.,I sliced bread up and sausage for sandwiches.,,_,еда,,
нарезать,8014,"chop, slice",,A,B2,LM,3,нарезанный,Acc.Masc.Sing,"В салат добавьте мелко нарезанный лук, соль и перец. ","Add finely chopped onion, salt and pepper to the salad.",,_,еда,,
нарушать,8015,violate,,V,B2,LM,1,нарушает,Imperf.Sing.3,Этот водитель всё время нарушает правила дорожного движения.,This driver is constantly violating traffic regulations.,,_,"общение, политика",,
нарушать,8016,violate,,V,B2,LM,2,нарушать,Imperf.Inf,С детства нас учат не нарушать закон.,"From childhood, we are taught not to break the law.",,_,"общение, политика",,
нарушать,8017,violate,,V,B2,LM,3,нарушая,Imperf.Gerund,"Бизнесмен богател, не нарушая при этом закон.",The businessman got rich without breaking the law. ,,_,"общение, политика",,
насмотреться,8018,see enough,,V,B2,LM,1,насмотрелся,Perf.Masc.Sing.Past,"Насмотрелся я на эту заграницу, больше никуда не поеду","I have seen enough of the world abroad, I'm not going to travel anymore.",,,мера,,
насмотреться,8019,see enough,,V,B2,LM,2,насмотрелись,Perf.Plur.Past,"Наши родители в детстве насмотрелись индийских фильмов, поэтому сейчас их не любят. ","Our parents watched too many Indian films during their childhood, so they don't like them anymore.",,_,мера,,
насмотреться,8020,see enough,,V,B2,LM,3,насмотрелась,Perf.Fem.Sing.Past,За годы работы в школе Мария Ивановна насмотрелась всякого.,During the years that she worked in a school Maria Ivanovna saw all kinds of things.,,_,мера,,
настойчивый,8021,persistеnt,,A,B2,LM,1,настойчивые,Nom.Plur,Мои настойчивые попытки дозвониться привели к положительному результату.,My persistent attempts to get through on the phone led to a positive result.,,_,общение,,
настойчивый,8022,persistеnt,,A,B2,LM,2,настойчивых,Gen.Plur,Лишь после настойчивых уговоров девушка согласилась выйти замуж. ,Only after persistent persuasion did the girl agree to get married.,,_,общение,,
настойчивый,8023,persistеnt,,A,B2,LM,3,настойчивым,Ins.Neut.Sing,Она была встревожена настойчивым желанием Николая проводить её до дома.,She was scared of Nikolay's persistence on walking her home.,,_,общение,,
настольный,8024,table-top,,A,B2,"Golosa, LM",1,настольную,Acc.Fem.Sing,"Вероника зажгла настольную лампу и села, взяв карандаш.","Veronica lit the desk lamp, sat down, and picked up a pencil.",,_,жильё,,
настольный,8025,table-top,,A,B2,"Golosa, LM",2,настольной,Gen.Fem.Sing,Свет от настольной лампы падал на разбросанные книги и тетради,The light from the desk lamp fell on the scattered books and notebooks,,_,жильё,,
настольный,8026,table-top,,A,B2,"Golosa, LM",3,настольных,Gen.Plur,"Эра настольных компьютеров заканчивается, приходит время мобильных устройств. ","The era of desktop computers is ending, the time for mobile devices is coming.",,_,жильё,,
наступление,8027,beginning,,N.Neut.Inan,B2,LM,1,наступления,Gen.Sing,Дети должны вернуться домой до наступления темноты.,The children are supposed to come back home before dark.,,_,время,,
наступление,8028,beginning,,N.Neut.Inan,B2,LM,2,наступлением,Ins.Sing,С наступлением холодов люди стремятся уехать в тёплые края. ,"When cold weather comes, people tend to travel to warmer places.",,_,время,,
наступление,8029,beginning,,N.Neut.Inan,B2,LM,3,наступлении,Loc.Sing,Необходимо сообщить о наступлении страхового случая в страховую компанию. ,"When a loss occurs that is covered by insurance, it is necessary to report the event to the insurance company.",,_,время,,
натуральный,8030,natural,,A,B2,LM,1,натуральных,Gen.Plur,Сегодня на уроке мы узнаем свойства натуральных чисел.,In today's lesson we will learn the properties of natural numbers.,,_,животные/растения,,
натуральный,8031,natural,,A,B2,LM,2,натурального,Gen.Masc.Sing,Молодых людей сегодня возмущает использование в одежде натурального меха. ,Young people today are outraged by the use of real fur in clothing.,,_,животные/растения,,
натуральный,8032,natural,,A,B2,LM,3,натуральным,Dat.Plur,Всё больше людей отдают предпочтение натуральным продуктам. ,More and more people prefer natural products.,,_,животные/растения,,
натюрморт,8033,still-life painting,,N.Masc.Inan,B2,LM,1,натюрморт,Nom.Sing,Этот натюрморт был написан в начале двадцатого века.,This still life was painted at the beginning of the twentieth century.,,_,свободное время,,
наушник,8034,earphones,,N.Masc.Inan,B2,LM,1,наушниках,Loc.Plur,В моих наушниках играет джаз.,There is jazz playing in my earphones.,,_,одежда,,
наушник,8035,earphones,,N.Masc.Inan,B2,LM,2,наушников,Gen.Plur,Без наушников Светлана чувствовала себя в толпе неуютно.,"Without her earphones, Svetlana felt uncomfortable in the crowd. ",,_,одежда,,
наушник,8036,earphones,,N.Masc.Inan,B2,LM,3,наушники,Nom.Plur,"Ой, кажется, наушники сломались.","Oops, I think my headphones broke.",,_,одежда,,
находчивый,8037,resourceful,,A,B2,LM,1,находчивый,Nom.Masc.Sing,"Он умный и находчивый парень, всегда находит выход из любой ситуации","He is a smart and resourceful fellow, he always finds a way out of any situation. ",,_,"люди, описание",,
находчивый,8038,resourceful,,A,B2,LM,2,находчивые,Nom.Plur,Находчивые производители всегда удивляют новыми товарами. ,Shrewd manufacturers are always surprising us with new products.,,_,"люди, описание",,
национализм,8039,nationalism,,N.Masc.Inan,B2,LM,1,национализм,Nom.Sing,Агрессивный национализм стал проблемой многих стран.,Aggressive nationalism has become a problem in many countries.,,_,политика,,
национализм,8040,nationalism,,N.Masc.Inan,B2,LM,2,национализма,Gen.Sing,Эксперты отмечают рост национализма в странах бывшего СССР.,Experts note the growth of nationalism in the countries of the former USSR.,,_,политика,,
националист,8041,nationalist,,N.Masc.Anim,B2,LM,1,националиста,Gen.Sing,Сторонников главного украинского националиста Степана Бандеры посадили в тюрьму. ,Supporters of the foremost Ukrainian nationalist Stepan Bandera were sent to prison.,,_,"люди, политика",,
националистический,8042,nationalistic,,A,B2,LM,1,националистическим,Ins.Masc.Sing,К власти пришла партия с националистическим уклоном. ,A party with a nationalistic bias came to power.,,_,политика,,
нация,8043,nation,,N.Fem.Inan,B2,LM,1,нации,Gen.Sing,Политики призывают к единству нации.,Politicians call for unity of the nation.,,_,"люди, политика",,
нация,8044,nation,,N.Fem.Inan,B2,LM,2,нация,Nom.Sing,"Жаль, что великая нация не сумела сохранить свои традиции.",It is a pity that this great nation was not able to maintain its traditions.,,_,"люди, политика",,
нация,8045,nation,,N.Fem.Inan,B2,LM,3,нацию,Acc.Sing,Государство стремится создать единую нацию.,The state is trying to create a single nation.,,_,"люди, политика",,
начальник,8046,boss,,N.Masc.Anim,B2,LM,1,начальник,Nom.Sing,Начальник отдела продаж выступил с докладом.,The head of sales department made a presentation.,,_,"учёба/работа, люди",,
начальник,8047,boss,,N.Masc.Anim,B2,LM,2,начальника,Gen.Sing,"Начальника департамента нет в офисе, он в командировке. ","The head of the department is not in the office, he is on a business trip.",,_,"учёба/работа, люди",,
начальник,8048,boss,,N.Masc.Anim,B2,LM,3,начальником,Ins.Sing,Петров стал начальником совсем недавно.,Petrov became the boss just recently.,,_,"учёба/работа, люди",,
начальный,8049,initial,,A,B2,LM,1,начальной,Gen.Fem.Sing,Ученики выходят из начальной школы с базовыми знаниями по разным предметам. ,Pupils leave primary school with basic knowledge in various subjects.,,_,учёба/работа,,
начальный,8050,initial,,A,B2,LM,2,начальных,Gen.Plur,Учителя начальных классов требуют повышения заработной платы. ,Primary school teachers are demanding higher wages.,,_,учёба/работа,,
начальный,8051,initial,,A,B2,LM,3,начальном,Loc.Masc.Sing,На начальном этапе все сотрудники были довольны своими ролями. ,"In the initial stage, all the employees were happy with their roles.",,_,учёба/работа,,
небольшой,8052,not large,,A,B2,LM,1,небольшая,Nom.Fem.Sing,У меня к тебе есть небольшая просьба.,I have a small favor to ask you.,,_,мера,,
небольшой,8053,not large,,A,B2,LM,2,небольшой,Nom.Masc.Sing,Электросталь ― небольшой промышленный город.,Elektrostal is a small industrial city.,,_,мера,,
небольшой,8054,not large,,A,B2,LM,3,небольшие,Nom.Plur,"На сайте авиакомпании произошли небольшие изменения, что привело к ошибкам.","Minor changes were made on the airline’s website, and this led to errors.",,_,мера,,
невеселый,8055,unhappy,,A,B2,LM,1,невесёлые,Inan.Acc.Plur,"После поражения в игре Виталий шел домой, погружённый в невесёлые мысли.","After losing the game, Vitali went home deep in gloomy thoughts.",,_,внутренний мир,,
невеселый,8056,unhappy,,A,B2,LM,2,невесёлом,Loc.Neut.Sing,При каждом невесёлом воспоминании Тамара начинает плакать. ,"With every sad memory, Tamara begins to cry.",,_,внутренний мир,,
невеселый,8057,unhappy,,A,B2,LM,3,невесёлый,Nom.Masc.Sing,"Несмотря на праздничный костюм, вид у Руслана был невесёлый.","Despite his festive outfit, Ruslan looked unhappy.",,_,внутренний мир,,
невнимательный,8058,inattentive,,A,B2,LM,1,невнимательная,Nom.Fem.Sing,"Инна, ты опять допустила ошибку в отчёте - ты такая невнимательная!","Инна, you made a mistake in the report again - you are so careless!",,_,"внутренний мир, учёба/работа",,
невнимательный,8059,inattentive,,A,B2,LM,2,невнимателен,Masc.Sing,"У Коли плохие оценки в школе, потому что он невнимателен на уроках. ","Kolya has bad grades in school, because he doesn't pay attention in class.",,_,"внутренний мир, учёба/работа",,
невысокий,8060,not tall,,A,B2,LM,1,невысокий,Nom.Masc.Sing,"Был он невысокий, загорелый, мускулистый и очень активный. ","He was short, tanned, muscular and very active.",,_,"мера, описание",,
невысокий,8061,not tall,,A,B2,LM,2,невысок,Masc.Sing,Пушкин был невысок ростом.,Pushkin was not tall.,,_,"мера, описание",,
невысокий,8062,not tall,,A,B2,LM,3,невысокой,Loc.Fem.Sing,Продукты в нашем магазине отличаются хорошим качеством при невысокой стоимости. ,The products in our shop are of exceptionally good quality at low cost.,,_,"мера, описание",,
негромкий,8063,not loud,,A,B2,LM,1,негромким,Ins.Masc.Sing,"Юра негромким голосом поет под гитару, и все внимательно слушают.","Yura sings in a low voice to the music of the guitar, and everyone listens attentively.",,_,мера,,
недобрый,8064,unkind,,A,B2,LM,1,недобрым,Ins.Neut.Sing,"В пути нам много раз приходилось вспоминать недобрым словом людей, построивших плохие дороги. ",During our journey we often thought ill of the people who built those bad roads. ,,_,"внутренний мир, общение",,
недобрый,8065,unkind,,A,B2,LM,2,недоброму,Dat.Neut.Sing,"По недоброму выражению глаз Александра мы поняли, что лучше больше не задавать ему вопросов. ","From the unkind expression in Alexander's eyes, we realized that it was better not to ask him any more questions.",,_,"внутренний мир, общение",,
недобрый,8066,unkind,,A,B2,LM,3,недобр,Masc.Sing,"Старый пёс был хитёр и недобр, его никто не любил.","The old dog was sly and mean, no one liked him.",,_,"внутренний мир, общение",,
недорогой,8067,inexpensive,,A,B2,"MiP, LM",1,недорогую,Acc.Fem.Sing,"Молодая пара сняла недорогую, но приличную гостиницу на берегу моря. ",A young couple checked into an inexpensive but decent hotel ar the seashore.,,_,"мера, магазин",,
недорогой,8068,inexpensive,,A,B2,"MiP, LM",2,недорогой,Loc.Fem.Sing,Нам легко принять решение о недорогой покупке.,It is easy for us to make a decision about an inexpensive purchase.,,_,"мера, магазин",,
недорогой,8069,inexpensive,,A,B2,"MiP, LM",3,недорогое,Nom.Neut.Sing,Для выхода из кризиса существует недорогое и надежное решение. ,"To overcome the crisis, there is an inexpensive and reliable solution.",,_,"мера, магазин",,
недостаток,8070,disadvantage,,N.Masc.Inan,B2,LM,1,недостаток,Nom.Sing,Серьёзный недостаток автомобиля заключается в слишком дорогом обслуживании.,A serious drawback of a car is its expensive maintenance.,,_,описание,,
недостаток,8071,disadvantage,,N.Masc.Inan,B2,LM,2,недостатки,Acc.Plur,Не каждый видит свои слабости и недостатки. ,Not everyone sees their own weaknesses and limitations.,,_,описание,,
недостаток,8072,disadvantage,,N.Masc.Inan,B2,LM,3,недостатком,Ins.Sing,Сто лет назад высокий рост у женщин считался недостатком.,"A hundred years ago, it was considered a disadvantage for a woman to be tall.",,_,описание,,
неестественный,8073,unnatural,,A,B2,LM,1,неестественным,Ins.Masc.Sing,От падения нога вывернулась неестественным образом.,The fall caused the leg to twist in an unnatural way.,,_,описание,,
неестественный,8074,unnatural,,A,B2,LM,2,неестественно,Adverb,"Чтобы скрыть шум в соседней комнате, Марина говорила неестественно громко.","To drown out the noise in the next room, Marina spoke unnaturally loudly.",,_,описание,,
нежный,8075,tender,,A,B2,LM,1,нежный,Nom.Masc.Sing,Никите нельзя рассказывать страшные истории - он очень нежный и ранимый мальчик. ,You shouldn't tell scary stories to Nikita - he is a very gentle and vulnerable boy.,,_,"описание, внутренний мир",,
нежный,8076,tender,,A,B2,LM,2,нежная,Nom.Fem.Sing,У тайских женщин очень нежная кожа и не бывает веснушек.,Thai women have very delicate skin and no freckles.,,_,"описание, внутренний мир",,
нежный,8077,tender,,A,B2,LM,3,нежными,Ins.Plur,В церковном хоре дети нежными голосами поют о любви к богу.,Сhildren sing in gentle voices about their love to God in the church choir.,,_,"описание, внутренний мир",,
независимый,8078,independent,,A,B2,LM,1,независимых,Gen.Plur,В 1992 году 12 бывших союзных республик образовали Содружество Независимых Государств.,"In 1992, 12 former Soviet republics formed the Commonwealth of Independent States.",,_,"политика, внутренний мир",,
независимый,8079,independent,,A,B2,LM,2,независимыми,Ins.Plur,Новое изобретение требует проверки независимыми экспертами. ,The new invention requires verification by independent experts.,,_,"политика, внутренний мир",,
независимый,8080,independent,,A,B2,LM,3,независимый,Nom.Masc.Sing,Александр Смирнов баллотируется как независимый кандидат. ,Alexander Smirnov is running as an independent candidate.,,_,"политика, внутренний мир",,
неинтересный,8081,uninteresting,,A,B2,LM,1,неинтересно,Adverb,Современным детям неинтересно читать книги о советских временах.,Modern children are not interested in reading books about the Soviet era.,,_,внутренний мир,,
неинтересный,8082,uninteresting,,A,B2,LM,2,неинтересны,Plur,Родителям неинтересны переживания детей.,The parents are not interested in their children's emotions.,,_,внутренний мир,,
неинтересный,8083,uninteresting,,A,B2,LM,3,неинтересную,Acc.Fem.Sing,Вячеслав мечтает бросить неинтересную работу и стать дизайнером.,Vyacheslav dreams of quitting his boring job and becoming a designer.,,_,внутренний мир,,
немолодой,8084,middle-aged,,A,B2,LM,1,немолодую,Acc.Fem.Sing,"Семён нагло рассматривает немолодую, но красивую женщину.",Semion is staring rudely at a middle-aged but still beautiful woman. ,,_,мера,,
немолодой,8085,middle-aged,,A,B2,LM,2,немолодой,Nom.Masc.Sing,Неожиданно в дом приезжает полковник американской армии ― немолодой серьёзный мужчина.,"Suddenly, an American army colonel - a middle-aged serious man - arrives at the house.",,_,мера,,
немолодой,8086,middle-aged,,A,B2,LM,3,немолодая,Nom.Fem.Sing,Министром здравоохранения стала немолодая и очень опытная женщина.,A middle-aged and very experienced woman became the Minister of Health.,,_,мера,,
настаивать,8087,insist,,V,B2,LM,1,настаивал,Imperf.Masc.Sing.Past,Адвокат настаивает на невиновности своего клиента.,The lawyer insists on the innocence of his client.,,_,общение,,
настаивать,8088,insist,,V,B2,LM,2,настаивать,Imperf.Inf,"Хоть Игорь и считал, что он прав, он не стал настаивать на своём.","Although Igor believed that he was right, he did not insist.",,_,общение,,
настаивать,8089,insist,,V,B2,LM,3,настаивали,Imperf.Plur.Past,"Врачи настаивали, что Чехову нужно больше отдыхать на море.",Doctors insisted that Chekhov needed more rest at the seashore.,,_,общение,,
ненависть,8090,hatred,,N.Fem.Inan,B2,LM,1,ненависти,Gen.Sing,Раньше Алиса ни к кому не чувствовала такой ненависти. ,Alice never felt such hatred towards anyone before.,,_,внутренний мир,,
ненависть,8091,hatred,,N.Fem.Inan,B2,LM,2,ненавистью,Ins.Sing,Военные с ненавистью и презрением смотрят на учёных. ,Military people regard scientists with hatred and contempt.,,_,внутренний мир,,
ненависть,8092,hatred,,N.Fem.Inan,B2,LM,3,ненависть,Nom.Sing,Ненависть заставляет нас вести себя глупо.,Hatred makes us act stupid.,,_,внутренний мир,,
