огород,8362,vegetable patch,,N.Masc.Inan,B2,LM,3,огорода,Gen.Sing,Огурцы с бабушкиного огорода всегда самые вкусные!,The cucumbers from grandmother's vegetable patch always taste best.,,_,"свободное время, жильё",,
объезжать,8363,detour,,V,B2,LM,1,объезжать,Imperf.Inf,"Улицу Ленина закрыли на ремонт, до конца лета нам придётся её объезжать.","Lenin street has been closed for repairs, so we will have to take a detour until the end of the summer.",,_,"путешествие, транспорт",,
ограничение,8364,limitation,,N.Neut.Inan,B2,LM,1,ограничения,Acc.Plur,"Это судно класса ""река-море"", оно имеет ограничения для плавания по морям.","This vessel has ""river-see"" certification, it has limitations on sailing on the sea. ",,_,"транспорт, мера",,
ограничение,8365,limitation,,N.Neut.Inan,B2,LM,2,ограничение,Nom.Sing,На этой дороге действует ограничение скорости - тридцать километров в час.,This road has a speed limit of thirty kilometers per hour.,,_,"транспорт, мера",,
ограничение,8366,limitation,,N.Neut.Inan,B2,LM,3,ограничений,Gen.Plur,С новым тарифом я могу звонить тебе без ограничений. ,"With the new rate scale, I can call you without limitations.",,_,"транспорт, мера",,
объехать,8367,detour,,V,B2,LM,1,объехала,Perf.Fem.Sing.Past,Знаменитая певица объехала с гастролями весь мир. ,The famous singer travelled around the whole world on tour.,,_,"путешествие, транспорт",,
получаться,8368,result,,V,B2,"Golosa, LM",1,получается,Imperf.Sing.3,"Везёт тебе, у тебя всё получается с первого раза. ","Lucky you, you always succeed at everything on the first try.",,_,"учёба/работа, внутренний мир",,
получаться,8369,result,,V,B2,"Golosa, LM",2,получалось,Imperf.Neut.Sing.Past,"Инга очень хотела уснуть, но у неё долго не получалось. ","Inga really wanted to get to sleep, but she couldn't do it for a long time.",,_,"учёба/работа, внутренний мир",,
получаться,8370,result,,V,B2,"Golosa, LM",3,получаться,Imperf.Inf,"Сначала будет тяжело, но потом начнёт получаться.","At first it will be hard, but then it will start to turn out right.",,_,"учёба/работа, внутренний мир",,
одеколон,8371,cologne,,N.Masc.Inan,B2,LM,1,одеколону,Gen.Sing,Дай мне немного своего одеколону. ,Give me some of your cologne.,,_,"люди, одежда",,
одеколон,8372,cologne,,N.Masc.Inan,B2,LM,2,одеколона,Gen.Sing,"Я не буду сидеть рядом с Николаем, он использует слишком много одеколона.","I will not sit next to Nikolai, he uses too much cologne.",,_,"люди, одежда",,
оглохнуть,8373,go deaf,,A,B2,LM,1,оглохший,Perf.PastActiveParticiple.Nom.Masc.Sing,"Степан вернулся с войны хромой и почти оглохший, но продолжил работать. ","Stepan returned from the war lame and almost deaf, but continued to work.",,_,здоровье,,
оглохнуть,8374,go deaf,,A,B2,LM,2,оглохшему,Perf.PastActiveParticiple.Dat.Masc.Sing,"Оглохшему от взрывов Тимуру показалось, что битва кончилась, но он ошибся.","Timur who was deafened by the explosions thought that the battle was over, but he was mistaken.",,_,здоровье,,
оглохнуть,8375,go deaf,,V,B2,LM,3,оглохнув,Perf.Gerund,"Они не слышали друг друга, оглохнув от шума самолётов. ","They could not hear each other, deafened by noise of the airplanes.",,_,здоровье,,
одеяло,8376,blanket,,N.Neut.Inan,B2,LM,1,одеялом,Ins.Sing,"Я всегда сплю под толстым одеялом, даже летом. ","I always sleep under a thick blanket, even in winter.",,_,"жильё, свободное время",,
одеяло,8377,blanket,,N.Neut.Inan,B2,LM,2,одеяло,Acc.Sing,Оля дрожала от холода и куталась в одеяло. ,Olya trembled from cold and wrapped herself in a blanket.,,_,"жильё, свободное время",,
одеяло,8378,blanket,,N.Neut.Inan,B2,LM,3,одеяла,Gen.Sing,Я часто сплю без одеяла. ,I often sleep without a blanket.,,_,"жильё, свободное время",,
одинокий,8379,lonely,,A,B2,LM,1,одинокий,Nom.Masc.Sing,"Филипп - одинокий отец, ему нужна помощь. ","Fillip is a single father, he needs help.",,_,"внутренний мир, общение",,
одинокий,8380,lonely,,A,B2,LM,2,одинокой,Gen.Fem.Sing,Из одинокой и грустной девочки Алиса превратилась в очаровательную популярную женщину. ,"From a lonely and sad girl, Alice turned into a charming popular woman.",,_,"внутренний мир, общение",,
одинокий,8381,lonely,,A,B2,LM,3,одинок,Masc.Sing,"Я так одинок сейчас, что хочу умереть. ",I am so lonely now that I want to die.,,_,"внутренний мир, общение",,
одиночество,8382,loneliness,,N.Neut.Inan,B2,LM,1,одиночества,Gen.Sing,Новогодняя вечеринка - лучшее средство от одиночества.,A New Year's party is the best medicine for loneliness. ,,_,"внутренний мир, общение",,
одиночество,8383,loneliness,,N.Neut.Inan,B2,LM,2,одиночестве,Loc.Sing,Я не хочу встречать старость в одиночестве. ,I do not want to deal with old age alone.,,_,"внутренний мир, общение",,
одиночество,8384,loneliness,,N.Neut.Inan,B2,LM,3,одиночество,Nom.Sing,"Тех, кто не похож на других, ждёт постоянное одиночество.",Constant loneliness awaits those who are not like the others.,,_,"внутренний мир, общение",,
однократный,8385,one-time,,A,B2,LM,1,однократных,Loc.Plur,Жильцы общежития обязаны предупреждать администрацию об однократных визитах гостей.,Residents of the dormitory are obliged to inform the administration about every single guest visit.,,_,"мера, описание",,
однократный,8386,one-time,,A,B2,LM,2,однократный,Inan.Acc.Masc.Sing,За однократный въезд в страну без визы вам придётся заплатить лишь небольшой штраф.,For a single entry into the country without a visa you must pay just a small fee.,,_,"мера, описание",,
одноместный,8387,single-occupancy,,A,B2,LM,1,одноместными,Ins.Plur,Из холла гостиницы мы попали в коридор с одноместными комнатами.,From the hotel lobby we entered a corridor with single rooms.,,_,"жильё, путешествие",,
однообразный,8388,monotonous,,A,B2,LM,1,однообразный,Nom.Masc.Sing,Однообразный вид из окна поезда навевает тоску. ,The monotonous view from the train's window makes you sad.,,_,внутренний мир,,
однообразный,8389,monotonous,,A,B2,LM,2,однообразные,Nom.Plur,"Однообразные задания не подходят нашим детям, из-за них им становится скучно в школе.","Monotonous tasks are not suitable for our childrem, they make them bored at school.",,_,внутренний мир,,
однообразный,8390,monotonous,,A,B2,LM,3,однообразной,Loc.Fem.Sing,"Он считал, что ему нечего было рассказывать о своей скучной и однообразной жизни.",He felt that he had nothing to tell about his boring and monotonous life.,,_,внутренний мир,,
одноразовый,8391,one-time-use,,A,B2,LM,1,одноразового,Gen.Neut.Sing,Экологи призывают отказаться от одноразового использования вещами.,Environmentalists are encouraging people to stop using single-use items.,,_,описание,,
однородный,8392,homogeneous,,A,B2,LM,1,однородным,Ins.Masc.Sing,"Раствор должен получиться однородным, без комочков.","The mixture should be smooth, without lumps.",,_,описание,,
однородный,8393,homogeneous,,A,B2,LM,2,однородную,Acc.Fem.Sing,Взбейте муку и яйца в однородную массу.,Beat flour and eggs into a homogeneous mass.,,_,описание,,
однородный,8394,homogeneous,,A,B2,LM,3,однородный,Nom.Masc.Sing,Для украшения сада нам нужен однородный мелкий песок. ,"To decorate the garden, we need smooth fine sand.",,_,описание,,
оглядываться,8395,look back,,V,B2,LM,1,оглядываясь,Imperf.Gerund,"Карина попрощалась и ушла, не оглядываясь.",Karina said goodbye and left without looking back.,,_,"люди, общение",,
оглядываться,8396,look back,,V,B2,LM,2,оглядывались,Imperf.Plur.Past,Туристы стояли на вокзале и пугливо оглядывались по сторонам. ,The tourists stood at the train station and looked around in fear.,,_,"люди, общение",,
оглядываться,8397,look back,,V,B2,LM,3,оглядываются,Imperf.Plur.3,"Ксения - очень красивая женщина, мужчины всегда оглядываются ей вслед. ","Ksenia is a beautiful woman, men always turn to look at her.",,_,"люди, общение",,
одуванчик,8398,dandelion,,N.Masc.Inan,B2,LM,1,одуванчиков,Gen.Plur,Мальчик принёс маме с прогулки букет из одуванчиков. ,The boy brought his mother a bouquet of dandelions from the walk.,,_,животные/растения,,
ожидание,8399,anticipation,,N.Neut.Inan,B2,LM,1,ожидания,Gen.Sing,Время ожидания в очереди не превышает десяти минут. ,Waiting time in the line does not exceed ten minutes.,,_,внутренний мир,,
ожидание,8400,anticipation,,N.Neut.Inan,B2,LM,2,ожидании,Loc.Sing,Солдаты замерли в ожидании новых приказов. ,The soldiers held still waiting for new orders. ,,_,внутренний мир,,
ожидание,8401,anticipation,,N.Neut.Inan,B2,LM,3,ожиданием,Ins.Sing,"Все с ожиданием смотрели на Лидию, но она больше ничего не сказала.","Everyone looked at Lydia in expectation, but she said nothing more.",,_,внутренний мир,,
ожог,8402,burn,,N.Masc.Inan,B2,LM,1,ожогов,Gen.Plur,После пожара на руках Олега остались следы от ожогов. ,After the fire there were burn marks on Oleg’s hands,,_,здоровье,,
оглянуться,8403,look back,,V,B2,LM,1,оглянуться,Perf.Inf,Всё чаще хочется оглянуться назад и вернуться в молодость.,Ever more often one wants to look back and return to one's youth.,,_,"люди, общение",,
оглянуться,8404,look back,,V,B2,LM,2,оглянулся,Perf.Masc.Sing.Past,"Выйдя за ворота, я оглянулся на нашу дачу.","On my way out of the gate, I looked back at our cottage.",,_,"люди, общение",,
оглянуться,8405,look back,,V,B2,LM,3,оглянувшись,Perf.Gerund,"Оглянувшись, Миша заметил, что Эдуард и Женя бегут за ним.","Looking around, Misha noticed that Edward and Zhenya were running after him.",,_,"люди, общение",,
ограбить,8406,rob,,V,B2,LM,1,ограбить,Perf.Inf,"Не ходи вечером через парк, там тебя могут ограбить. ","Do not walk through the park in the evening, you could get robbed there.",,_,"люди, здоровье",,
ограбить,8407,rob,,V,B2,LM,2,ограбила,Perf.Fem.Sing.Past,В октябре банда ограбила больше десяти квартир. ,In October the gang robbed more than ten apartments.,,_,"люди, здоровье",,
ограбить,8408,rob,,V,B2,LM,3,ограбят,Perf.Plur.3,"Не волнуйся, здесь тебя не ограбят.","Don’t worry, you won't get robbed here.",,_,"люди, здоровье",,
ограничивать,8409,limit,,V,B2,LM,1,ограничивает,Imperf.Sing.3,Новый закон ограничивает свободу граждан.,The new law restricts the freedom of citizens.,,_,"политика, общение",,
ограничивать,8410,limit,,V,B2,LM,2,ограничивать,Imperf.Inf,Мать не хочет ни в чём ограничивать своего сына.,The mother does not want to limit her son in any way.,,_,"политика, общение",,
ограничивать,8411,limit,,V,B2,LM,3,ограничивают,Imperf.Plur.3,Государства ограничивают импорт из Ирана по политическим причинам.,Countries are restricting imports from Iran for political reasons.,,_,"политика, общение",,
окорок,8412,ham,,N.Masc.Inan,B2,LM,1,окорок,Acc.Sing,"Купи в магазине копчёный окорок, у нас гости. ","Buy a smoked ham in the store, we're having guests.",,_,еда,,
окорок,8413,ham,,N.Masc.Inan,B2,LM,2,окорока,Gen.Sing,"Собака принесла кость - всё, что осталось от окорока. ",The dog brought a bone - that was all that was left of the ham.,,_,еда,,
окраина,8414,outskirts,,N.Fem.Inan,B2,LM,1,окраине,Loc.Sing,Путешественники остановились на окраине города. ,The travelers stopped on the outskirts of the city.,,_,"жильё, транспорт",,
окраина,8415,outskirts,,N.Fem.Inan,B2,LM,2,окраинах,Loc.Plur,На окраинах Москвы строится много новых районов.,A lot of new new districts are being built on the outskirts of Moscow.,,_,"жильё, транспорт",,
окраина,8416,outskirts,,N.Fem.Inan,B2,LM,3,окраины,Gen.Sing,Макс - обычный парень с окраины Твери.,Max is an ordinary guy from the outskirts of Tver.,,_,"жильё, транспорт",,
окрошка,8417,okroshka,,N.Fem.Inan,B2,LM,1,окрошка,Nom.Sing,Окрошка - любимый летний суп многих россиян. ,Okroshka is a favorite summer soup of many Russians.,,_,еда,,
округ,8418,district,,N.Masc.Inan,B2,LM,1,округа,Gen.Sing,Ученики всех школ нашего округа каждый год проводят экскурсии в столицу.,Pupils from all the schools in our district go on excursions to the capital every year.,,_,политика,,
округ,8419,district,,N.Masc.Inan,B2,LM,2,округе,Loc.Sing,В Сибирском федеральном округе сохраняется высокий уровень безработицы.,In the Siberian Federal District there is a high level of unemployment.,,_,политика,,
округ,8420,district,,N.Masc.Inan,B2,LM,3,округах,Loc.Plur,Во многих округах Москвы проходят встречи кандидатов с молодёжью. ,In many districts of Moscow they are holding meetings of candidates with youth.,,_,политика,,
ограничиваться,8421,be limited to,,V,B2,LM,1,ограничивается,Imperf.Sing.3,Применение пластика в пищевой промышленности постепенно ограничивается.,The use of plastic in the food industry is being gradually curtailed.,,_,описание,,
ограничиваться,8422,be limited to,,V,B2,LM,2,ограничиваться,Imperf.Inf,Современный учитель не может ограничиваться только учебниками. ,A modern teacher cannot be limited only to textbooks.,,_,описание,,
ограничиваться,8423,be limited to,,V,B2,LM,3,ограничиваются,Imperf.Plur.3,Возможности новых телефонов не ограничиваются только звонками и СМС. ,The functionality of new phones is not limited to calls and text messages.,,_,описание,,
окружающий,8424,surrounding,,A,B2,LM,1,окружающей,Gen.Fem.Sing,Защита окружающей среды - главная задача нового поколения. ,Protection of the environment is the main task of the new generation.,,_,"погода, животные/растения",,
окружающий,8425,surrounding,,A,B2,LM,2,окружающего,Gen.Masc.Sing,Познание окружающего мира очень важно для детей.,Exploring the surrounding world is very important for children.,,_,"погода, животные/растения",,
окружающий,8426,surrounding,,A,B2,LM,3,окружающую,Acc.Fem.Sing,Не загрязняйте окружающую среду!,Do not pollute the environment!,,_,"погода, животные/растения",,
окулист,8427,oculist,,N.Masc.Anim,B2,LM,1,окулисту,Dat.Sing,Мне нужно пойти к окулисту - я стала плохо видеть.,I should go to an eye doctor - I have started having trouble seeing.,,_,здоровье,,
олень,8428,deer,,N.Masc.Anim,B2,LM,1,оленей,Gen.Plur,В Лапландии живёт двести тысяч человек и столько же северных оленей.,Two hundred thousand people and as many reindeer live in Lapland.,,_,животные/растения,,
олень,8429,deer,,N.Masc.Anim,B2,LM,2,олень,Nom.Sing,Олень - благородное и красивое животное. ,The deer is a noble and beautiful animal.,,_,животные/растения,,
олень,8430,deer,,N.Masc.Anim,B2,LM,3,оленя,Gen.Sing,На спине у оленя были белые пятнышки. ,The deer had white spots on its back.,,_,животные/растения,,
оливковый,8431,olive,,A,B2,LM,1,оливковым,Ins.Neut.Sing,Салат можно заправить оливковым маслом или майонезом.,A salad can be seasoned with olive oil or mayonnaise.,,_,"животные/растения, еда",,
оливковый,8432,olive,,A,B2,LM,2,оливковое,Nom.Neut.Sing,"Оливковое масло полезнее, чем сливочное.",Olive oil is healthier than butter.,,_,"животные/растения, еда",,
оливковый,8433,olive,,A,B2,LM,3,оливковую,Acc.Fem.Sing,Голубь несёт в клюве оливковую ветвь - символ мира.,A dove carrying an olive branch in its beak is a symbol of peace.,,_,"животные/растения, еда",,
олимпиада,8434,olympiad,,N.Fem.Inan,B2,LM,1,олимпиады,Gen.Sing,После олимпиады многие стали больше интересоваться спортом. ,"After the Olympics, many people became more interested in sports.",,_,"свободное время, учёба/работа",,
олимпиада,8435,olympiad,,N.Fem.Inan,B2,LM,2,олимпиаду,Acc.Sing,"Возможно, сборная России не поедет на следующую олимпиаду. ",Perhaps the Russian team will not go to the next Olympics.,,_,"свободное время, учёба/работа",,
олимпиада,8436,olympiad,,N.Fem.Inan,B2,LM,3,олимпиаде,Loc.Sing,На Олимпиаде в Атланте сборная России заняла четвёртое место.,"At the Olympics in Atlanta, the Russian team took fourth place.",,_,"свободное время, учёба/работа",,
олимпийский,8437,olympic,,A,B2,"Golosa, LM",1,олимпийской,Gen.Fem.Sing,Некоторые хотели исключить фигурное катание из олимпийской программы. ,Some people wanted to exclude figure skating from the Olympic program.,,_,свободное время,,
олимпийский,8438,olympic,,A,B2,"Golosa, LM",2,олимпийскую,Acc.Fem.Sing,В олимпийскую деревню приехали первые спортсмены.,The first athletes have arrived at the Olympic village.,,_,свободное время,,
олимпийский,8439,olympic,,A,B2,"Golosa, LM",3,олимпийском,Loc.Masc.Sing,В олимпийском комитете идут споры о выборе нового президента.,There are debates in the Olympic committee about choosing a new president.,,_,свободное время,,
омлет,8440,omelette,,N.Masc.Inan,B2,LM,1,омлет,Acc.Sing,Завтра я встану пораньше и приготовлю тебе омлет на завтрак.,Tomorrow I'll get up early and cook you an omelet for breakfast.,,_,еда,,
оперетта,8441,operetta,,N.Fem.Inan,B2,LM,1,оперетты,Gen.Sing,"На сцене Московской оперетты во вторник прошла премьера ""Нотр-Дам де Пари"".",The premiere of Notre Dame de Paris took place at the Moscow Operetta on Tuesday.,,_,свободное время,,
оперетта,8442,operetta,,N.Fem.Inan,B2,LM,2,оперетт,Gen.Plur,В советское время в магазинах продавали много пластинок с ариями из оперетт.,"In Soviet times, there were a lot of records with operetta arias sold in the shops.",,_,свободное время,,
описание,8443,description,,N.Neut.Inan,B2,LM,1,описания,Gen.Sing,Отношения Маяковского и Лили Брик заслуживают отдельного описания.,The relationship between Mayakovsky and Lilya Brik deserves a separate description.,,_,описание,,
описание,8444,description,,N.Neut.Inan,B2,LM,2,описание,Nom.Sing,Первое детальное описание нового металла было сделано Соколовой.,The first detailed description of the new metal was made by Sokolova.,,_,описание,,
описание,8445,description,,N.Neut.Inan,B2,LM,3,описании,Loc.Sing,В описании города ничего не говорится о его музеях.,The description of the city does not say anything about its museums.,,_,описание,,
одерживать,8446,gain,,V,B2,LM,1,одерживая,Imperf.Gerund,"Наполеон шёл по Европе, одерживая победу за победой.","Napoleon marched through Europe, winning victory after victory.",,_,"свободное время, учёба/работа",,
одерживать,8447,gain,,V,B2,LM,2,одерживать,Imperf.Inf,Неожиданно российская команда начала одерживать всё больше побед.,"Suddenly, the Russian team started winning more victories.",,_,"свободное время, учёба/работа",,
одерживать,8448,gain,,V,B2,LM,3,одерживала,Imperf.Fem.Sing.Past,По жизни Вера шла напролом и одерживала победы.,"Vera went through life boldly, winning victories on her way.",,_,"свободное время, учёба/работа",,
опоздание,8449,delay,,N.Neut.Inan,B2,LM,1,опозданием,Ins.Sing,Владелец компании явился на пресс-конференцию с огромным опозданием.,The owner of the company arrived at the press conference very late.,,_,"транспорт, учёба/работа",,
опоздание,8450,delay,,N.Neut.Inan,B2,LM,2,опоздания,Acc.Plur,В школе нас ругают за опоздания.,At school we are punished for being late.,,_,"транспорт, учёба/работа",,
опорный,8451,supporting,,A,B2,LM,1,опорный,Nom.Masc.Sing,Опорный пункт полиции находится в соседнем доме.,The police station is located next door.,,_,описание,,
