поговорка,9026,saying,,N.Fem.Inan,B2,LM,1,поговорка,Nom.Sing,"Ученик должен объяснить, что значит поговорка.",The student must explain what the saying means.,,_,общение,,
поговорка,9027,saying,,N.Fem.Inan,B2,LM,2,поговорок,Gen.Plur,В русском языке много поговорок.,There are many sayings in Russian.,,_,общение,,
поговорка,9028,saying,,N.Fem.Inan,B2,LM,3,поговорку,Acc.Sing,Даша произнесла свою любимую поговорку.,Dasha repeated her favorite saying.,,_,общение,,
пограничник,9029,border guard,,N.Masc.Anim,B2,LM,1,пограничниками,Ins.Plur,При прохождении границы не стоит шутить с пограничниками.,"When crossing the border, you should not make jokes with the border guards.",,_,политика,,
пограничник,9030,border guard,,N.Masc.Anim,B2,LM,2,пограничников,Gen.Plur,В результате неожиданного нападения пострадало шестнадцать пограничников.,Sixteen border guards were hurt during an unexpected attack.,,_,политика,,
погасить,9031,extinguish,,V,B2,LM,1,погасить,Perf.Inf,Вам необходимо погасить задолженность.,You need to pay off the debt.,,_,"магазин, политика",,
погасить,9032,extinguish,,V,B2,LM,2,погашу,Perf.Sing.1,"Надеюсь, в этом году я погашу кредит за квартиру.",This year I hope to pay off the mortgage on the apartment.,,_,"магазин, политика",,
погасить,9033,extinguish,,A,B2,LM,3,погашено,Perf.PastPassiveParticiple.Neut.Sing,Сегодня всё освещение в городе будет погашено на час. ,All the lighting in the city will be put out for an hour today.,,_,"магазин, политика",,
подбородок,9034,chin,,N.Masc.Inan,B2,LM,1,подбородок,Nom.Sing,Подбородок посетителя был выдвинут вперед.,The visitor stuck out his chin.,,_,"здоровье, люди",,
подбородок,9035,chin,,N.Masc.Inan,B2,LM,2,подбородком,Ins.Sing,При падении Матвей ударился подбородком о стол.,"When falling, Matvey hit his chin on the table.",,_,"здоровье, люди",,
подбородок,9036,chin,,N.Masc.Inan,B2,LM,3,подбородке,Loc.Sing,На подбородке выскочил прыщ. ,A pimple popped up on my chin.,,_,"здоровье, люди",,
подвал,9037,basement,,N.Masc.Inan,B2,"Golosa, LM",1,подвал,Acc.Sing,Ахмед купил небольшой подвал и мечтает открыть в нём кафе.,Ahmed bought a small basement and wants to open a café in it.,,_,жильё,,
подвал,9038,basement,,N.Masc.Inan,B2,"Golosa, LM",2,подвале,Loc.Sing,В подвале жилого дома часто прячутся кошки.,Cats often hide in the basement of the apartment building.,,_,жильё,,
подвал,9039,basement,,N.Masc.Inan,B2,"Golosa, LM",3,подвалы,Acc.Plur,Старые минские здания имели очень глубокие подвалы.,Old buildings in Minsk had very deep basements.,,_,жильё,,
подвиг,9040,deed,,N.Masc.Inan,B2,"MiP, LM",1,подвиг,Acc.Sing,Потомки не забудут подвиг первого космонавта.,Future generations will not forget the achievment of the first astronaut.,,_,"учёба/работа, люди, здоровье",,
подвиг,9041,deed,,N.Masc.Inan,B2,"MiP, LM",2,подвигу,Dat.Sing,В жизни всегда есть место подвигу!,In life there is always a place for a heroic act.,,_,"учёба/работа, люди, здоровье",,
подвиг,9042,deed,,N.Masc.Inan,B2,"MiP, LM",3,подвиги,Nom.Plur,Подвиги советских солдат перечислены в исторических документах.,The achievements of Soviet soldiers are detailed in the historical documents.,,_,"учёба/работа, люди, здоровье",,
погладить,9043,"stroke, iron",,V,B2,LM,1,погладить,Perf.Inf,Я всегда мечтал погладить тигра.,I always dreamed of petting a tiger.,,_,"общение, одежда",,
погладить,9044,"stroke, iron",,V,B2,LM,2,погладила,Perf.Fem.Sing.Past,Мать погладила сына по голове. ,The mother patted her son on the head.,,_,"общение, одежда",,
погладить,9045,"stroke, iron",,V,B2,LM,3,погладили,Perf.Plur.Past,В химчистке мне постирали и погладили всю одежду.,I had all my clothes washed and ironed at the dry-cleaner's.,,_,"общение, одежда",,
поглядеть,9046,take a look,,V,B2,LM,1,поглядел,Perf.Masc.Sing.Past,Марат поглядел на закат и вернулся в дом.,Marat looked at the sunset and returned to the house.,,_,люди,,
поглядеть,9047,take a look,,V,B2,LM,2,погляди,Perf.Imper.Sing.2,"Погляди скорей, что по телевизору показывают. ","Quick, take a look at what's on TV.",,_,люди,,
поглядеть,9048,take a look,,V,B2,LM,3,поглядела,Perf.Fem.Sing.Past,Алия поглядела по сторонам и быстро подняла деньги.,Alia glanced around and quickly picked up the money.,,_,люди,,
погнаться,9049,chase,,V,B2,LM,1,погонятся,Perf.Plur.3,"Если за нами погонятся, нужно сразу разделиться.","If they chase after us, we must split up immediately.",,_,люди,,
поговорить,9050,talk,,V,B2,LM,1,поговорить,Perf.Inf,Нам нужно серьёзно поговорить о твоём поступке.,We need to talk seriously about what you did.,,_,общение,,
поговорить,9051,talk,,V,B2,LM,2,поговорим,Perf.Plur.1,В сегодняшнем выпуске мы подробно поговорим о ситуации в Средней Азии.,"In today's episode, we will talk in detail about the situation in Central Asia.",,_,общение,,
поговорить,9052,talk,,V,B2,LM,3,поговорили,Perf.Plur.Past,В этот раз друзья поговорили начистоту. ,This time the friends spoke their mind.,,_,общение,,
подавать,9053,pass,,V,B2,LM,1,подаёт,Imperf.Sing.3,Корабль в Средиземном море подаёт сигнал бедствия. ,A ship in the Mediterranean is giving a distress signal.,,_,описание,,
подавать,9054,pass,,V,B2,LM,2,подавать,Imperf.Inf,Старосты школы должны подавать пример ученикам.,School prefects should set an example for students.,,_,описание,,
подавать,9055,pass,,V,B2,LM,3,подают,Imperf.Plur.3,Яблоки и чернослив традиционно подают с гусем.,Apples and prunes are traditionally served with goose.,,_,описание,,
подбегать,9056,run up,,V,B2,LM,1,подбегают,Imperf.Plur.3,Дети подбегают к Деду Морозу за конфетами.,Children run up to Father Frost for candy.,,_,люди,,
подбегать,9057,run up,,V,B2,LM,2,подбегали,Imperf.Plur.Past,К месту происшествия уже подбегали прохожие.,Passers-by were already running up to the scene of the accident.,,_,люди,,
подбегать,9058,run up,,V,B2,LM,3,подбегала,Imperf.Fem.Sing.Past,Раньше собака подбегала к хозяйке по первой команде.,The dog used to run to her mistress on the first command.,,_,люди,,
поддержка,9059,support,,N.Fem.Inan,B2,LM,1,поддержку,Acc.Sing,Музыканты выступили в поддержку политических заключённых.,The musicians spoke out in support of political prisoners.,,_,"внутренний мир, общение",,
поддержка,9060,support,,N.Fem.Inan,B2,LM,2,поддержки,Gen.Sing,В перерыве матча выступила группа поддержки.,The cheerleaders performed during half-time.,,_,"внутренний мир, общение",,
поддержка,9061,support,,N.Fem.Inan,B2,LM,3,поддержка,Nom.Sing,Мне сейчас нужна твоя моральная поддержка.,I need your moral support now.,,_,"внутренний мир, общение",,
подвигать,9062,move,,V,B2,LM,1,подвигал,Imperf.Masc.Sing.Past,"Динар осмотрел себя в зеркале, подвигал плечами и замер.","Dinar examined himself in the mirror, shrugged his shoulders, and froze.",,_,"люди, описание",,
подвигать,9063,move,,V,B2,LM,2,подвигав,THIS FORM IS RARE -- leave it out,,_,,_,_,,
подвигаться,9064,move,,V,B2,LM,1,подвигаться,Imperf.Inf,"В школе должна быть комната, где дети могли бы свободно подвигаться.",In school there should be a room where children can move freely.,,_,"люди, описание",,
подводить,9065,lead,,V,B2,LM,1,подводит,Imperf.Sing.3,Интуиция меня никогда не подводит.,Intuition never fails me.,,_,"внутренний мир, общение",,
подводить,9066,lead,,V,B2,LM,2,подводя,Imperf.Gerund,"Подводя итоги, хочу напомнить всем о событиях этого года.","Summing up, I want to remind everyone about this year's events.",,_,"внутренний мир, общение",,
подводить,9067,lead,,V,B2,LM,3,подвожу,Imperf.Sing.1,Сегодня я подвожу итоги и делаю выводы.,Today I am summarizing and drawing conclusions.,,_,"внутренний мир, общение",,
подвозить,9068,give a lift,,V,B2,LM,1,подвозить,Imperf.Inf,Пётр стал всё чаще подвозить Алину до дома.,Peter started giving Alina a lift home more often.,,_,транспорт,,
подвозить,9069,give a lift,,V,B2,LM,2,подвозили,Imperf.Plur.Past,Раствор и бетон подвозили прямо на стройку в больших автомобилях.,Cement and concrete were transported directly to the construction site in large vehicles.,,_,транспорт,,
подлежащее,9070,subject,,N.Neut.Inan,B2,LM,1,подлежащее,Nom.Sing,"Подлежащее обычно отвечает на вопросы ""Кто?"" и ""Что"".","The subject usually answers the questions ""Who?"" and ""What?"".",,_,"учёба/работа, описание",,
подготовить,9071,prepare,,V,B2,LM,1,подготовить,Perf.Inf,Первые дипломаты должны только подготовить почву для торговых переговоров.,The first diplomats should only set the stage for the trade negotiations.,,_,"учёба/работа, внутренний мир",,
подготовить,9072,prepare,,V,B2,LM,2,подготовила,Perf.Fem.Sing.Past,Материалы подготовила журналистка Анна Портнягина.,The journalist Anna Portnyagina prepared the content.,,_,"учёба/работа, внутренний мир",,
подготовить,9073,prepare,,A,B2,LM,3,подготовленные,Perf.PastPassiveParticiple.Nom.Plur,В регионах необходимы хорошо подготовленные специалисты.,Well-trained specialists are required in regional areas..,,_,"учёба/работа, внутренний мир",,
подействовать,9074,affect,,V,B2,LM,1,подействовало,Perf.Neut.Sing.Past,Лекарство подействовало только через несколько дней.,The medicine only took affect after a few days.,,_,"внутренний мир, здоровье",,
подействовать,9075,affect,,V,B2,LM,2,подействовала,Perf.Fem.Sing.Past,"Чтобы музыка на вас подействовала, она должна нравиться.","In order for music to have an effect on you, you have to like it.",,_,"внутренний мир, здоровье",,
поделить,9076,divide,,V,B2,LM,1,поделили,Perf.Plur.Past,Наследство поделили поровну между братьями.,The inheritance was divided equally between the brothers.,,_,"политика, мера",,
поделить,9077,divide,,A,B2,LM,2,поделён,Perf.PastPassiveParticiple.Masc.Sing,Рынок нефти был поделён в середине восьмидесятых.,The oil market was divided in the mid-eighties.,,_,"политика, мера",,
поделить,9078,divide,,A,B2,LM,3,поделено,Perf.PastPassiveParticiple.Neut.Sing,Пространство выставки поделено на зоны.,The exhibition space is divided into zones.,,_,"политика, мера",,
подоконник,9079,windowsill,,N.Masc.Inan,B2,LM,1,подоконнике,Loc.Sing,На подоконнике росла целая коллекция кактусов.,A whole collection of cactuses were growing on the windowsill.,,_,жильё,,
подоконник,9080,windowsill,,N.Masc.Inan,B2,LM,2,подоконник,Acc.Sing,Кошка запрыгнула на подоконник.,The cat jumped onto the windowsill.,,_,жильё,,
подоконник,9081,windowsill,,N.Masc.Inan,B2,LM,3,подоконниках,Loc.Plur,У нас на всех подоконниках стоят горшки с цветами.,We have flower pots on all the windowsills.,,_,жильё,,
касаться,9082,"touch, concern",,V,B2,"Golosa, LM",1,касается,Imperf.Sing.3,"Вы можете решить, что вас это не касается, но это не так.","You might think that this does not concern you, but that's not the case.",,_,"описание, общение",,
касаться,9083,"touch, concern",,V,B2,"Golosa, LM",2,касалось,Imperf.Neut.Sing.Past,"Когда дело касалось чьей-то репутации, Ренат становился осторожным.","When it was a matter of someone’s reputation, Renat was cautious.",,_,"описание, общение",,
касаться,9084,"touch, concern",,A,B2,"Golosa, LM",3,касающиеся,Imperf.PresentActiveParticiple.Nom.Plur,"На саммите обсуждались вопросы, касающиеся российско-украинских отношений.",The summit discussed issues about Russian-Ukrainian relations.,,_,"описание, общение",,
поделиться,9085,share,,V,B2,LM,1,поделиться,Perf.Inf,Зульфия хотела поделиться своей радостью с друзьями.,Zulfia wanted to share her joy with her friends.,,_,"общение, мера",,
поделиться,9086,share,,V,B2,LM,2,поделился,Perf.Masc.Sing.Past,Главный врач поделился своим мнением с журналистами.,The head physician shared his opinion with the reporters.,,_,"общение, мера",,
поделиться,9087,share,,V,B2,LM,3,поделится,Perf.Sing.3,"Он жадный, никогда ни с кем не поделится.","He is greedy, he never shares with anyone.",,_,"общение, мера",,
подпись,9088,signature,,N.Fem.Inan,B2,LM,1,подписью,Ins.Sing,Учреждения начали принимать документы с электронной подписью.,Institutions started accepting documents with a digital signature.,,_,учёба/работа,,
подпись,9089,signature,,N.Fem.Inan,B2,LM,2,подпись,Nom.Sing,Для подачи документов нужна твоя подпись.,Your signature is required for submitting the documents.,,_,учёба/работа,,
подпись,9090,signature,,N.Fem.Inan,B2,LM,3,подписей,Gen.Plur,Идёт сбор подписей за кандидата в депутаты.,Signatures are being collected for the candidate for deputy.,,_,учёба/работа,,
подешеветь,9091,cheapen,,A,B2,LM,1,подешевевший,Acc.Masc.Sing,,_,,_,_,,"RARE WORD, LEAVE OUT"
подполковник,9092,lieutenant colonel,,N.Masc.Anim,B2,LM,1,подполковник,Nom.Sing,Подполковник полиции Александр Трошков стал начальником нового подразделения.,Police lieutenant colonel Alexander Troshkov became the head of the new unit.,,_,учёба/работа,,
подполковник,9093,lieutenant colonel,,N.Masc.Anim,B2,LM,2,подполковника,Gen.Sing,Весёлов закончил военную службу в звании подполковника.,Veselov finished his military service at the rank of lieutenant colonel.,,_,учёба/работа,,
подполковник,9094,lieutenant colonel,,N.Masc.Anim,B2,LM,3,подполковнику,Dat.Sing,Рядовой доложил подполковнику о прибытии комиссии.,The private reported to the lieutenant colonel about the arrival of the commission.,,_,учёба/работа,,
подмести,9095,sweep up,,V,B2,LM,1,подмету,Perf.Sing.1,"Отдыхай, я сам здесь подмету.","Relax, I will sweep here myself.",,_,"учёба/работа, жильё",,
подмести,9096,sweep up,,V,B2,LM,2,подмети,Perf.Imper.Sing.2,"Вымой посуду и подмети пол, после этого можешь идти гулять.","Wash the dishes and sweep the floor, then you can go for a walk.",,_,"учёба/работа, жильё",,
подмести,9097,sweep up,,V,B2,LM,3,подмёл,Perf.Masc.Sing.Past,Я подмёл пол во всём доме. ,I swept the floor throughout the house.,,_,"учёба/работа, жильё",,
подметать,9098,sweep,,V,B2,LM,1,подметать,Imperf.Inf,Из-за аллергии на пыль я не люблю подметать.,"Because of my dust allergy, I do not like sweeping floors.",,_,"учёба/работа, жильё",,
подметать,9099,sweep,,V,B2,LM,2,подметает,Imperf.Sing.3,В новом доме папа подметает полы каждый день.,Dad sweeps the floors in the new house every day.,,_,"учёба/работа, жильё",,
подметать,9100,sweep,,V,B2,LM,3,подметал,Imperf.Masc.Sing.Past,"Мирон устроился разнорабочим: подметал двор, носил тяжести. ",Miron got a job as a handyman: he swept the yard and carried heavy things.,,_,"учёба/работа, жильё",,
подросток,9101,teenager,,N.Masc.Anim,B2,LM,1,подростков,Gen.Plur,У современных подростков больше технических навыков.,Teenagers these days have more technical skills.,,_,люди,,
подросток,9102,teenager,,N.Masc.Anim,B2,LM,2,подростка,Gen.Sing,Тело подростка быстро меняется.,A teenager's body changes quickly.,,_,люди,,
подросток,9103,teenager,,N.Masc.Anim,B2,LM,3,подростки,Nom.Plur,Подростки не любят говорить о своих чувствах.,Teenagers do not like to talk about their feelings.,,_,люди,,
подогревать,9104,heat,,V,B2,LM,1,подогревать,Imperf.Inf,Известный актёр любит подогревать интерес к своей персоне.,The famous actor likes to attract interest to himself.,,_,общение,,
подогревать,9105,heat,,A,B2,LM,2,подогреваемые,Imperf.PresentPassiveParticiple.Nom.Plur,Подогреваемые азартом игроки делали большие ставки.,"Fueled by excitement, the players made big bets.",,_,общение,,
подорожать,9106,become more expensive,,V,B2,LM,1,подорожает,Perf.Sing.3,С нового года водка подорожает.,The price of vodka will go up at the beginning of the year. ,,_,магазин,,
подорожать,9107,become more expensive,,V,B2,LM,2,подорожало,Perf.Neut.Sing.Past,За последние три года всё сильно подорожало.,"Over the past three years, everything has become significantly more expensive.",,_,магазин,,
подорожать,9108,become more expensive,,V,B2,LM,3,подорожали,Perf.Plur.Past,В прошлом месяце продукты резко подорожали.,Groceries got more expensive last month. ,,_,магазин,,
подписываться,9109,subscribe,,V,B2,LM,1,подписываются,Imperf.Plur.3,Тысячи граждан подписываются под требованиями снизить налоги.,Thousands of citizens are signing petitions demanding tax cuts.,,_,"политика, общение, учёба/работа",,
подписываться,9110,subscribe,,V,B2,LM,2,подписываюсь,Imperf.Sing.1,Подписываюсь под каждым твоим словом!,I support you 100 percent!,,_,"политика, общение, учёба/работа",,
подписываться,9111,subscribe,,V,B2,LM,3,подписывается,Imperf.Sing.3,На последней странице договора подписывается директор компании.,The head of the company is signing the last page of the contract.,,_,"политика, общение, учёба/работа",,
подрабатывать,9112,have a side job,,V,B2,LM,1,подрабатывал,Imperf.Masc.Sing.Past,В молодости я часто подрабатывал грузчиком.,When I was young I often worked part-time loading trucks.,,_,учёба/работа,,
подрабатывать,9113,have a side job,,V,B2,LM,2,подрабатывают,Imperf.Plur.3,Студенты часто подрабатывают на каникулах.,Students often earn extra money during the holidays.,,_,учёба/работа,,
подрабатывать,9114,have a side job,,V,B2,LM,3,подрабатывать,Imperf.Inf,"Мне часто приходится подрабатывать, чтобы содержать семью.",I often have to work extra to support my family.,,_,учёба/работа,,
подраться,9115,have a fight,,V,B2,LM,1,подраться,Perf.Inf,Коля любит подраться с соседскими мальчишками.,Kolya loves to fight with the neighboring boys.,,_,здоровье,,
подраться,9116,have a fight,,V,B2,LM,2,подрались,Perf.Plur.Past,"Сейчас мы друзья, но однажды мы чуть не подрались.","We are friends, but we almost got into a fight once.",,_,здоровье,,
подраться,9117,have a fight,,V,B2,LM,3,подерутся,Perf.Plur.3,"Ещё немного, и они подерутся. ",They're going to start fighting any minute now.,,_,здоровье,,
подружиться,9118,make friends,,V,B2,LM,1,подружиться,Perf.Inf,"Мы могли бы подружиться, хоть ты и из другого города.","We could become friends, even though you are from another city.",,_,общение,,
подружиться,9119,make friends,,V,B2,LM,2,подружился,Perf.Masc.Sing.Past,В Приморском зоопарке тигр подружился с козлом.,A tiger made friends with a goat at the Primorsky zoo.,,_,общение,,
подружиться,9120,make friends,,V,B2,LM,3,подружилась,Perf.Fem.Sing.Past,Людмила сразу подружилась с соседями.,Lyudmila immediately made friends with her neighbors.,,_,общение,,
подсказывать,9121,hint,,V,B2,LM,1,подсказывают,Imperf.Plur.3,Дети подсказывают ответы своему однокласснику.,The children are whispering answers to their classmate.,,_,общение,,
подсказывать,9122,hint,,V,B2,LM,2,подсказывает,Imperf.Sing.3,"Интуиция подсказывает мне, что пора уходить.",My intuition tells me it's time to leave.,,_,общение,,
подсказывать,9123,hint,,V,B2,LM,3,подсказываю,Imperf.Sing.1,Я никогда не подсказываю соседу по парте.,I never give answers to my desk mate.,,_,общение,,
подушка,9124,pillow,,N.Fem.Inan,B2,LM,1,подушку,Acc.Sing,Положи голову на подушку. ,Put your head on the pillow.,,_,жильё,,
подушка,9125,pillow,,N.Fem.Inan,B2,LM,2,подушкой,Ins.Sing,Лёня прячет игрушки под подушкой.,Lionya hides his toys under his pillow.,,_,жильё,,
подушка,9126,pillow,,N.Fem.Inan,B2,LM,3,подушки,Acc.Plur,Производители автомобилей начали устанавливать современные подушки безопасности с 1963 года.,Car manufacturers have been installing modern airbags since 1963.,,_,жильё,,
