парад,8729,parade,,N.Masc.Inan,B2,LM,2,параду,Dat.Sing,Войска начинают готовиться к параду на рассвете.,The troops are starting to prepare for the parade at dawn.,,_,"люди, политика",,
парад,8730,parade,,N.Masc.Inan,B2,LM,3,парадами,Ins.Plur,Жители Москвы гордятся парадами на Красной площади.,The residents of Moscow are proud of the parades on Red Square.,,_,"люди, политика",,
охотиться,8731,hunt,,V,B2,LM,1,охотятся,Imperf.Plur.3,Змеи часто охотятся ночью.,Snakes often hunt at night.,,_,животные/растения,,
охотиться,8732,hunt,,A,B2,LM,2,охотящегося,Imperf.PresentActiveParticiple.Anim.Acc.Masc.Sing,Охотящегося тигра очень сложно заметить.,A hunting tiger is very difficult to spot.,,_,животные/растения,,
охотиться,8733,hunt,,V,B2,LM,3,охотиться,Imperf.Inf,"Братья любили охотиться и ловить рыбу, а не учиться.",The brothers loved to hunt and fish rather than study.,,_,животные/растения,,
параллельный,8734,parallel,,A,B2,LM,1,параллельных,Gen.Plur,Многие верят в существование параллельных миров.,Many believe in the existence of parallel universes.,,_,"описание, мера",,
параллельный,8735,parallel,,A,B2,LM,2,параллельная,Nom.Fem.Sing,Параллельная парковка - один из самых сложных элементов экзамена по вождению.,Parallel parking is one of the hardest parts of a driving test.,,_,"описание, мера",,
параллельный,8736,parallel,,A,B2,LM,3,параллельный,Inan.Acc.Masc.Sing,На конференции нам предоставили параллельный перевод докладчиков.,A parallel translation of the speakers was offered at the conference.,,_,"описание, мера",,
парикмахер,8737,hairdresser,,N.Masc.Anim,B2,"LM, Поехали",1,парикмахер,Nom.Sing,Парикмахер внимательно выслушал пожелания клиента.,The hairdresser listened carefully to the client's wishes.,,_,учёба/работа,,
парикмахер,8738,hairdresser,,N.Masc.Anim,B2,"LM, Поехали",2,парикмахеры,Nom.Plur,"Не всегда парикмахеры делают то, что их просят. ",Hairdressers do not always do what they are asked to.,,_,учёба/работа,,
парикмахер,8739,hairdresser,,N.Masc.Anim,B2,"LM, Поехали",3,парикмахером,Ins.Sing,"Евгений мечтал стать стилистом, а не просто парикмахером.","Eugene dreamed of becoming a stylist, not just a hairdresser.",,_,учёба/работа,,
парикмахерская,8740,hair salon,,N.Fem.Inan,B2,LM,1,парикмахерскую,Acc.Sing,Через пару лет работы я смогу открыть свою парикмахерскую.,"After a couple of years of work, I can open my own hair salon.",,_,учёба/работа,,
парикмахерская,8741,hair salon,,N.Fem.Inan,B2,LM,2,парикмахерской,Loc.Sing,"В парикмахерской меня убедили, что короткая стрижка мне не пойдёт.","At the hair salon, they convinced me that a short haircut would not suit me.",,_,учёба/работа,,
парикмахерская,8742,hair salon,,N.Fem.Inan,B2,LM,3,парикмахерская,Nom.Sing,Где здесь ближайшая парикмахерская?,Where is the nearest hair salon here?,,_,учёба/работа,,
паркет,8743,hardwood flooring,,N.Masc.Inan,B2,LM,1,паркета,Gen.Sing,Игорь молча рассматривал рисунок паркета.,Igor silently examined the pattern in the hardwood floor.,,_,жильё,,
паркет,8744,hardwood flooring,,N.Masc.Inan,B2,LM,2,паркете,Loc.Sing,"Однажды я поскользнулась на паркете, упала и сломала руку.","One day I slipped on the hardwood floor, fell and broke my arm.",,_,жильё,,
паркет,8745,hardwood flooring,,N.Masc.Inan,B2,LM,3,паркет,Nom.Sing,Полы дворца украшает художественный дубовый паркет.,The floors of the palace are decorated with artistic oak parquet.,,_,жильё,,
охранять,8746,guard,,V,B2,LM,1,охранять,Imperf.Inf,"Друзья ушли, оставив Илью охранять вещи.","His friends left, leaving Elijah to guard the things.",,_,политика,,
охранять,8747,guard,,V,B2,LM,2,охраняет,Imperf.Sing.3,Полиция охраняет покой граждан.,The police safeguard peace for the citizens.,,_,политика,,
охранять,8748,guard,,A,B2,LM,3,охраняемых,Imperf.PresentPassive.Participle.Gen.Plur,Около ста деревянных домов в нашем городе имеют статус охраняемых объектов. ,"About a hundred wooden houses in our city have a ""protected site"" status.",,_,политика,,
партер,8749,stalls,,N.Masc.Inan,B2,"MiP, LM",1,партера,Gen.Sing,Даже в первом ряду партера не всегда было слышно актёров на сцене.,Even in the front row of the stalls you couldn't always hear the actors on stage.,,_,свободное время,,
партер,8750,stalls,,N.Masc.Inan,B2,"MiP, LM",2,партере,Loc.Sing,"Места в партере стоят гораздо дороже, чем на балконе.",Seats in the stalls are much more expensive than on the balcony.,,_,свободное время,,
партер,8751,stalls,,N.Masc.Inan,B2,"MiP, LM",3,партер,Acc.Sing,Мы купили билеты в партер. ,We bought tickets for the stalls.,,_,свободное время,,
партийный,8752,party,,A,B2,LM,1,партийного,Gen.Masc.Sing,В последние годы никто уже не верил обещаниям партийного руководства.,For the past few years no one has believed the party leadership's promises.,,_,политика,,
партийный,8753,party,,A,B2,LM,2,партийное,Inan.Acc.Neut.Sing,Лаврентий Павлович снова не пришёл на партийное собрание.,Lavrenty Pavlovich did not come to the party meeting yet again.,,_,политика,,
партийный,8754,party,,A,B2,LM,3,партийных,Gen.Plur,Лев Львович был из числа партийных работников.,Lev Lvovich was one of the party workers.,,_,политика,,
парфюмерия,8755,perfume,,N.Fem.Inan,B2,"Golosa, LM",1,парфюмерия,Nom.Sing,В нашем магазине продается французская парфюмерия по низким ценам.,Our shop sells French perfumes at low prices.,,_,магазин,,
парфюмерия,8756,perfume,,N.Fem.Inan,B2,"Golosa, LM",2,парфюмерии,Gen.Sing,Где в вашем магазине отдел парфюмерии?,Where is the perfume department in your store?,,_,магазин,,
парфюмерия,8757,perfume,,N.Fem.Inan,B2,"Golosa, LM",3,парфюмерией,Ins.Sing,Из-за аллергии Зина не может пользоваться парфюмерией.,Zina cannot use perfume because she is allergic.,,_,магазин,,
пасмурный,8758,cloudy,,A,B2,LM,1,пасмурных,Gen.Plur,"В прошлом году в Лондоне было меньше пасмурных дней, чем в Москве.",Last year there were fewer cloudy days in London than in Moscow.,,_,погода,,
пасмурный,8759,cloudy,,A,B2,LM,2,пасмурную,Acc.Fem.Sing,В пасмурную погоду приятно остаться дома и почитать книгу.,In dismal weather it is nice to stay at home and read a book.,,_,погода,,
пасмурный,8760,cloudy,,A,B2,LM,3,пасмурным,Ins.Neut.Sing,"Одним пасмурным утром он решил, что больше не хочет здесь жить.",One dismal morning he decided that he no longer wanted to live here.,,_,погода,,
паспортный,8761,passport,,A,B2,"MiP, LM",1,паспортных,Gen.Plur,Сотрудники паспортных столов объясняют посетителям правила подачи документов.,The passport office staff are explaining the rules for submitting documents to visitors.,,_,политика,,
паспортный,8762,passport,,A,B2,"MiP, LM",2,паспортным,Ins.Masc.Sing,Я захотела пить ещё перед паспортным контролем.,I started wanting to drink even before passport control.,,_,политика,,
паспортный,8763,passport,,A,B2,"MiP, LM",3,паспортный,Nom.Masc.Sing,Паспортный контроль размещается в нейтральной зоне.,Passport control is located in the neutral zone.,,_,политика,,
пассив,8764,liability,,N.Masc.Inan,B2,LM,1,пассивах,Loc.Plur,Информация об активах и пассивах банка отражена в отчётах.,Information about the bank's assets and liabilities is reflected in the reports.,,_,"магазин, мера",,
пассив,8765,liability,,N.Masc.Inan,B2,LM,2,пассивов,Gen.Plur,Изменения на рынке негативно сказались на стоимости банковских пассивов.,Changes in the market negatively affected the value of bank liabilities.,,_,"магазин, мера",,
пассив,8766,liability,,N.Masc.Inan,B2,LM,3,пассивами,Ins.Plur,Руководство не рискует проводить операции с пассивами предприятия. ,Management is not risking playing the market with the company's liabilities.,,_,"магазин, мера",,
пассивный,8767,passive,,A,B2,LM,1,пассивных,Gen.Plur,"Родители не вмешивались в проблемы детей, а заняли роли пассивных наблюдателей.","The parents did not intervene in their children's problems, but rather passively observed from the sideline.",,_,"люди, мера, описание",,
пассивный,8768,passive,,A,B2,LM,2,пассивный,Nom.Masc.Sing,Пассивный образ жизни ведёт к проблемам со здоровьем.,A passive lifestyle leads to health problems.,,_,"люди, мера, описание",,
пассивный,8769,passive,,A,B2,LM,3,пассивные,Nom.Plur,"Не забудьте, что все пассивные доходы должны быть задекларированы. ",Do not forget to declare your residual income.,,_,"люди, мера, описание",,
пасха,8770,Easter,,N.Fem.Inan,B2,"Golosa, LM",1,пасха,Nom.Sing,Католическая Пасха отмечается на неделю раньше православной.,Catholic Easter is celebrated a week earlier than Orthodox Easter.,,_,время,,
пасха,8771,Easter,,N.Fem.Inan,B2,"Golosa, LM",2,пасху,Acc.Sing,На Пасху мы обычно раскрашиваем яйца. ,At Easter we usually paint eggs.,,_,время,,
пасха,8772,Easter,,N.Fem.Inan,B2,"Golosa, LM",3,пасхи,Gen.Sing,После Пасхи мы поедем в отпуск.,After Easter we will go on vacation.,,_,время,,
патриот,8773,patriot,,N.Masc.Anim,B2,LM,1,патриоты,Nom.Plur,"Патриоты не хотят уезжать из страны, несмотря на трудности.","The patriots do not want to leave the country, despite the difficulties.",,_,политика,,
патриот,8774,patriot,,N.Masc.Anim,B2,LM,2,патриотов,Gen.Plur,В стране всё меньше настоящих патриотов.,There are fewer true patriots in the country.,,_,политика,,
патриот,8775,patriot,,N.Masc.Anim,B2,LM,3,патриот,Nom.Sing,Я патриот своей страны и горжусь этим.,I am a patriot of my country and proud of it.,,_,политика,,
патриотизм,8776,patriotism,,N.Masc.Inan,B2,LM,1,патриотизм,Nom.Sing,"Патриотизм не появляется при рождении, его нужно воспитывать. ",Patriotism does not appear at birth; it needs to be taught.,,_,политика,,
патриотизм,8777,patriotism,,N.Masc.Inan,B2,LM,2,патриотизме,Loc.Sing,На кухне друзья вели долгие разговоры о стране и патриотизме.,The friends had long conversations in the kitchen about the country and patriotism.,,_,политика,,
патриотизм,8778,patriotism,,N.Masc.Inan,B2,LM,3,патриотизма,Gen.Sing,Солдаты защищали свою страну из чувства патриотизма. ,Soldiers defended their country out of a feeling of patriotism.,,_,политика,,
пауза,8779,pause,,N.Fem.Inan,B2,"MiP, LM",1,пауза,Nom.Sing,"Я устала, мне нужна небольшая пауза.","I'm tired, I need a little break.",,_,время,,
пауза,8780,pause,,N.Fem.Inan,B2,"MiP, LM",2,паузы,Gen.Sing,После секундной паузы докладчик продолжил выступление.,After a short pause the speaker continued his presentation.,,_,время,,
пауза,8781,pause,,N.Fem.Inan,B2,"MiP, LM",3,паузу,Acc.Sing,"Устройте себе небольшой отдых, сделайте паузу.","Take a little rest, have a break.",,_,время,,
паук,8782,spider,,N.Masc.Anim,B2,LM,1,пауки,Nom.Plur,Мне сегодня снились пауки.,Today I dreamed of spiders.,,_,животные/растения,,
паук,8783,spider,,N.Masc.Anim,B2,LM,2,пауков,Gen.Plur,Олег боится пауков больше всего на свете.,Oleg is afraid of spiders more than anything.,,_,животные/растения,,
паук,8784,spider,,N.Masc.Anim,B2,LM,3,паукам,Dat.Plur,Маме не нравится интерес Данилы к паукам и насекомым.,Mom does not like Danila's interest in spiders and insects.,,_,животные/растения,,
оштрафовать,8785,fine,,V,B2,LM,1,оштрафуют,Perf.Plur.3,За неправильную парковку тебя здесь оштрафуют на пять тысяч рублей.,You will be fined five thousand rubles for improper parking here.,,_,"политика, мера",,
оштрафовать,8786,fine,,V,B2,LM,2,оштрафуй,Perf.Imper.Sing.2,"Оштрафуй сотрудника за опоздание, и он начнёт приходить вовремя.","Penalize an employee for being late, and he will start to come on time.",,_,"политика, мера",,
оштрафовать,8787,fine,,V,B2,LM,3,оштрафовать,Perf.Inf,За выезд на встречную полосу могут оштрафовать и даже лишить прав.,For going onto the oncoming lane you can be fined and even be stripped of your driver's license.,,_,"политика, мера",,
пачка,8788,pack,,N.Fem.Inan,B2,LM,1,пачку,Acc.Sing,Не забудь купить пачку сливочного масла.,Don't forget to buy a stick of butter.,,_,мера,,
пачка,8789,pack,,N.Fem.Inan,B2,LM,2,пачкой,Ins.Sing,Курьер размахивал перед прохожими пачкой газет.,The courier brandished a stack of newspapers in front of passers-by.,,_,мера,,
пачка,8790,pack,,N.Fem.Inan,B2,LM,3,пачками,Ins.Plur,Чемодан на столе набит пачками денег.,The suitcase on the table is packed with bundles of money.,,_,мера,,
ощущать,8791,feel,,V,B2,LM,1,ощущает,Imperf.Sing.3,Сегодня Руслан особенно остро ощущает своё одиночество.,Ruslan is especially acutely aware of his loneliness today.,,_,внутренний мир,,
ощущать,8792,feel,,V,B2,LM,2,ощущать,Imperf.Inf,Приятно в марте ощущать на коже тепло весеннего солнца.,In March it is nice to feel the warmth of the spring sun on your skin.,,_,внутренний мир,,
ощущать,8793,feel,,V,B2,LM,3,ощущаю,Imperf.Sing.1,"Сегодня я выспалась, поэтому ощущаю во всём теле необыкновенную лёгкость.","Today I slept well, so I feel an extraordinary lightness throughout my body.",,_,внутренний мир,,
парализовать,8794,paralyze,,V,B2,LM,1,парализует,Biasp.Sing.3,Страх перед неизвестностью парализует волю.,Fear of the unknown paralyzes your will.,,_,здоровье,,
парализовать,8795,paralyze,,A,B2,LM,2,парализованы,Perf.PastPassiveParticiple.Plur,"После аварии у Алана парализованы ноги, он больше не может ходить.","After the accident, Alan’s legs were paralyzed, he can no longer walk.",,_,здоровье,,
парализовать,8796,paralyze,,V,B2,LM,3,парализовать,Perf.Inf,Яд некоторых змей может парализовать тело человека за несколько минут.,The venom of some snakes can paralyze the human body in a few minutes.,,_,здоровье,,
паштет,8797,pate,,N.Masc.Inan,B2,LM,1,паштет,Acc.Sing,Гость заказал утиный паштет и бокал вина.,The guest ordered duck pâté and a glass of wine.,,_,еда,,
паштет,8798,pate,,N.Masc.Inan,B2,LM,2,паштеты,Nom.Plur,Домашние колбасы и паштеты из индейки продаются на ярмарках по выходным.,Homemade turkey sausages and pâtés are sold at fairs on weekends.,,_,еда,,
педагогический,8799,pedagogical,,A,B2,LM,1,педагогического,Gen.Masc.Sing,Без педагогического образования нельзя работать учителем в школе.,"Without teacher training, you cannot work as a teacher at a school.",,_,учёба/работа,,
педагогический,8800,pedagogical,,A,B2,LM,2,педагогический,Nom.Masc.Sing,"Смоленский педагогический институт набирает студентов по специальности ""учитель начальных классов"".","Smolensk Pedagogical Institute is recruiting students majoring in ""elementary school teaching.""",,_,учёба/работа,,
педагогический,8801,pedagogical,,A,B2,LM,3,педагогической,Gen.Fem.Sing,У Людмилы Фёдоровны огромный опыт педагогической деятельности.,Lyudmila Fedorovna has vast experience in teaching.,,_,учёба/работа,,
пейзаж,8802,landscape,,N.Masc.Inan,B2,LM,1,пейзаж,Acc.Sing,Огромная новостройка на берегу реки портит пейзаж.,A huge new building on the bank of the river is spoiling the landscape.,,_,животные/растения,,
пейзаж,8803,landscape,,N.Masc.Inan,B2,LM,2,пейзажи,Acc.Plur,Художник раз за разом писал удивительные пейзажи Дальнего Востока.,The artist painted the amazing landscapes of the Far East over and over again.,,_,животные/растения,,
пейзаж,8804,landscape,,N.Masc.Inan,B2,LM,3,пейзажей,Gen.Plur,В России немало фантастических пейзажей.,There are many fantastic landscapes in Russia.,,_,животные/растения,,
пельмень,8805,dumpling,,N.Masc.Inan,B2,LM,1,пельмени,Nom.Plur,Пельмени - лёгкий способ быстро поужинать.,Dumplings are an easy way to have a quick dinner.,,_,еда,,
пельмень,8806,dumpling,,N.Masc.Inan,B2,LM,2,пельменями,Ins.Plur,Моя мама хочет угостить тебя домашними пельменями.,My mom wants to treat you with homemade dumplings.,,_,еда,,
пельмень,8807,dumpling,,N.Masc.Inan,B2,LM,3,пельменей,Gen.Plur,Вот приду домой и съем целую тарелку пельменей.,I’ll come home and eat a whole plate of dumplings.,,_,еда,,
пена,8808,foam,,N.Fem.Inan,B2,LM,1,пена,Nom.Sing,От быстрого бега у лошади шла пена изо рта.,The horse was frothing at the mouth because of the fast run.,,_,здоровье,,
пена,8809,foam,,N.Fem.Inan,B2,LM,2,пены,Gen.Sing,"В бане жарко, в воздухе летают хлопья мыльной пены. ","It’s hot in the bath, puffs of soapy foam are flying in the air.",,_,здоровье,,
пена,8810,foam,,N.Fem.Inan,B2,LM,3,пене,Loc.Sing,"Саша выскочил из ванной, весь в мыльной пене и абсолютно голый.","Sasha jumped out of the bathroom, all in soapy foam and completely naked.",,_,здоровье,,
переговоры,8811,negotiation,,N.Inan,B2,LM,1,переговоры,Acc.Plur,Представители компании ведут переговоры с зарубежными инвесторами.,The company representatives are negotiating with foreign investors.,,_,"общение, политика",,
переговоры,8812,negotiation,,N.Inan,B2,LM,2,переговоров,Gen.Plur,В результате нелёгких переговоров было достигнуто согласие.,The difficult negotiations resulted in an agreement being reached.,,_,"общение, политика",,
переговоры,8813,negotiation,,N.Inan,B2,LM,3,переговорах,Loc.Plur,На переговорах присутствовали главы государств и министры.,Heads of state and ministers attended the talks.,,_,"общение, политика",,
пахнуть,8814,smell,,V,B2,"Golosa, LM",1,пахло,Imperf.Neut.Sing.Past,В воздухе пахло весной. ,The smell of spring was in the air.,,_,описание,,
пахнуть,8815,smell,,V,B2,"Golosa, LM",2,пахнет,Imperf.Sing.3,После похода вся одежда пахнет дымом.,After the expedition all our clothes smell of smoke.,,_,описание,,
пахнуть,8816,smell,,V,B2,"Golosa, LM",3,пахнут,Imperf.Plur.3,Свежие простыни пахнут мылом.,The fresh sheets smell of soap.,,_,описание,,
пачкать,8817,stain,,V,B2,LM,1,пачкают,Imperf.Plur.3,Дети всегда что-нибудь пачкают и портят.,The children are always staining and spoiling something.,,_,одежда,,
пачкать,8818,stain,,V,B2,LM,2,пачкать,Imperf.Inf,"Глеб отошёл подальше от ямы, чтобы не испачкать ботинки.",Gleb moved away from the pothole so as not to stain his shoes.,,_,одежда,,
пачкаться,8819,get dirty,,V,B2,LM,1,пачкаются,Imperf.Plur.3,Белые вещи пачкаются быстрее.,White things get dirty faster.,,_,одежда,,
перевязывать,8820,bandage,,V,B2,LM,1,перевязывали,Imperf.Plur.Past,Девушки перевязывали раненому руку.,The girls bandaged the wounded man's arm.,,_,здоровье,,
перекресток,8821,intersection,,N.Masc.Inan,B2,LM,1,перекрёстке,Loc.Sing,"Будь внимательным, на этом перекрёстке нет светофоров.","Be careful, there are no traffic lights at this intersection.",,_,транспорт,,
перекресток,8822,intersection,,N.Masc.Inan,B2,LM,2,перекрёсток,Nom.Sing,Ночью перекрёсток освещается только одним фонарём.,"At night, the intersection is lit by only one light.",,_,транспорт,,
перекресток,8823,intersection,,N.Masc.Inan,B2,LM,3,перекрёстки,Nom.Plur,"Через пятьсот метров перекрёстки кончились, мы выехали из города.","The crossroads ended after five hundred meters, and we left the city.",,_,транспорт,,
переиздавать,8824,reprint,,V,B2,LM,1,переиздавали,Imperf.Plur.Past,Учебник по экономике переиздавали больше пяти раз.,The economics textbook has been reprinted more than five times.,,_,учёба/работа,,
переносной,8825,portable,,A,B2,LM,1,переносную,Acc.Fem.Sing,Татьяна взяла с собой переносную лампу.,Tatyana took a portable lamp with her.,,_,описание,,
переносной,8826,portable,,A,B2,LM,2,переносной,Inan.Acc.Masc.Sing,Внуки принесли бабушке в больницу маленький переносной телевизор.,The grandchildren brought a small portable TV to their grandmother at the hospital.,,_,описание,,
